date_utc,timestamp,title,text,subreddit,comments,url
2023-04-29,1682778789,Hotels.com Overcharge,"DO NOT tell hotels.com how many people are booking a reservation because theyll overcharge you because of a glitch in their system. 

I booked two equally priced rooms (3 person and a 2 person). I was charged for 3 people in both rooms, an extra charge of $200. 

Hotels.com only has a chat service. Nobody you can talk to explain things. So I explain my situation and they dont understand it. Literally saying things that are irrelevant. You were charged because there were 3 people. Nope, not for the second room. You were charged because children are considered adults for the reservation.  I get that. Not what Im angry about. We cant contact the hotel to talk about this. Im sorry. Seriously, thats my issue?  Im supposed to absorb the cost because you cant contact a 4 star hotel? Their most legitimate claim is prices are listed by the hotel on our website. Thats true, but I contacted hotels.com about the error in pricing. It clearly details and itemizes the cost of the extra person. This is a legitimate overcharge. I talked to the hotel. They agree I shouldnt be charged for the third person but they have no view into hotels.coms pricing. 

Moreover, I contacted them before I stayed there. The representative actually recommended that I stay and then fight the charge after my stay saying there was nothing the representative could do before the stay. Now Im stuck with no recourse. 

How do I get this resolved?",hotels,10,https://www.reddit.com/r/hotels/comments/132uzok/hotelscom_overcharge/
2023-04-29,1682776498,How can I find out who owns a hotel?,"I'll keep this brief, but I need to know who owns a hotel for legal reasons. I've read it's posted in the lobby, but how can I find that information without going in person?",hotels,15,https://www.reddit.com/r/hotels/comments/132tixy/how_can_i_find_out_who_owns_a_hotel/
2023-04-28,1682660637,Do hotel workers care how many people are staying in one room ?,"My family has this crazy ritual that only 2 people check in and the rest go and  hide  . Idk how to explain it tbh but the two people who usually check in act all professional and the 2 with  them ( usually me and my brother ) they make us not even enter the hotel but instead of walk outside like a bunch of homeless kids  until they finish chatting up with the receptionist and we cant even get extra door keys so they dont get  suspicious  

I swear they treat it like some fbi cia mission but I am pretty sure they dont give two shits 


So If you worked in a hotel/ know anything please answer my following questions 


- Do hotel workers care about how many people stay in one room 

- if for some reason they care , how would they handle the situation ? 



Thank you >­


Edit : thank you everyone for answering !",hotels,30,https://www.reddit.com/r/hotels/comments/131iwnr/do_hotel_workers_care_how_many_people_are_staying/
2023-04-27,1682618675,Hotel Room for 4 in Portugal,"Okay so my friends and I are planning a trip to Europe in September and were staying in Madeira, Portugal for 4 nights of our trip. Weve looked at AirBnbs and hotels and resorts, hoping to find something to accommodate.

My question is, I found a room at Pestana Carlton Madeira Ocean Resort Hotel that is large enough, but says its a family room for 2 adults and 2 children. Does anyone know if there would be any issue with myself and 3 adults staying there as opposed to 2 and 2 children?

Thanks so much!!",hotels,2,https://www.reddit.com/r/hotels/comments/1310if6/hotel_room_for_4_in_portugal/
2023-04-27,1682601507,"Someone opened my hotel room door last night, front desk says they have no record of it","Hello. Last night around 4am, I heard my hotel room door open and saw the light coming in the from hallway. I immediately yelled hey! and they said something (not sure what) and left after shutting my door. This hotel used those keycards to get into rooms.

This morning I go to the hotel staff to ask them about it, but they said no one had opened my door (I guess they have records of who used keycard?). But I am confident someone did.

Is the hotel not telling me something on purpose or is something else going on that bypasses their records?",hotels,12,https://www.reddit.com/r/hotels/comments/130lx7e/someone_opened_my_hotel_room_door_last_night/
2023-04-27,1682581405,Agoda address,"Hello,

Does anyone have an idea as to why most Agoda reservations are populated with the 999/9 Rama road the office at address in Bangkok? I work for a Hilton and I see these all the time. Thank you for your help",hotels,3,https://www.reddit.com/r/hotels/comments/130dfx0/agoda_address/
2023-04-26,1682545645,Housekeeping at Hilton,"Does anyone know what guidelines the house keepers with Hilton follow? Im at a Home2 stay with Hilton (Im a diamond member travel for work) and normally they come by and clean once a week which is fine with me but yesterday I got back to my hotel and everything had been moved and organized. Im not the cleanest person but Im not super messy either some clothes on the floor, miscellaneous stuff on counters, and what not. Well there wasnt a single thing that had not been moved, I had a jar of peanut butter sitting on the kitchenette counter and it was moved to a shelf which obviously isnt a big deal but it didnt matter what it was I even had a bottle of lube in the shower with all my soap and stuff and it was moved. I had been left a note several weeks ago that they couldnt make my bed because I had stuff on it and werent allowed to move it so they just left sheets by my bed which is fine by me. Then just 1 day after I came back from work and my bed had been made and I had 2 extra pillows. Is this normal?",hotels,3,https://www.reddit.com/r/hotels/comments/1300pv8/housekeeping_at_hilton/
2023-04-26,1682518935,Booking a room but changing number of guests,"Question: if I book a room for just myself and the room has a max occupancy of 2 people, do I need to modify it for the 2nd person to stay in the room with me? I booked a room for a trip but my partner might be able to join for a couple of days and we'd like to stay in already booked room. But we are not sure if we need to change something or pay extra? I don't want to change the reservation because it is not a a guaranteed thing yet.",hotels,11,https://www.reddit.com/r/hotels/comments/12zj3m0/booking_a_room_but_changing_number_of_guests/
2023-04-25,1682462374,Is Agoda reliable?,Im booking a hotel and its way cheaper on agoda but ive never used this before and dont want to get scammed. Is it a reliable booking company?,hotels,20,https://www.reddit.com/r/hotels/comments/12yyjap/is_agoda_reliable/
2023-04-23,1682250455,Is Doronin destroying the Aman Group?,"I see plans for Aman locations in Bangkok, LA, Miami on the heels of a slew of other city locations and this guy put his bimbo gf in charge of Aman lifestyle brands trying to hawk clothes and creams, etc...it feels like this guy does not at all understand what the brand was about and what made it special and now he's trying to milk whatever $ he can out of making this another ho hum ""luxury"" hotel brand before exiting. What a shame.",hotels,6,https://www.reddit.com/r/hotels/comments/12w5txe/is_doronin_destroying_the_aman_group/
2023-04-23,1682228296,Jobs with a stable schedule,"So I work as a front desk agent at a Marriott franchise &amp; I thought working in the hotel industry is something I actually wanted to do. But after basically being a human punching bag &amp; never having a stable schedule, I am looking for other options. Dont get me wrong, I work for such a good company, great managers &amp; amazing benefits but I feel myself getting burnt out. My schedule is different every week, sometimes I only ever have 1 day off after working 5 days straight. I hate the fact that I work weekends &amp; holidays too. I feel like I have no social life &amp; it is draining me. My manager also wants me to get into our high potential program but I dont even know if I want to stay in this industry. Are there any hotel jobs that actually have stable schedules? Or just any jobs that allow flexibility or have stable schedules. Anything helps!",hotels,22,https://www.reddit.com/r/hotels/comments/12vx9b6/jobs_with_a_stable_schedule/
2023-04-22,1682132111,Any RRI employees on here? Will the dark red accent walls be repainted?,"I do like the red accent wall at RRI, but I have to admit it looks a little dated. Ive seen some pictures online where the accent walls have been painted grey. Is this mandatory per corporate, and by when do hotels need to comply? Thanks!",hotels,0,https://www.reddit.com/r/hotels/comments/12usbw5/any_rri_employees_on_here_will_the_dark_red/
2023-04-21,1682051768,Booking Hotels Last Minute on Road Trip,"Hi, I am 20 F driving back from New York to Texas at the end of April, and I will turn 21 in early June. I will be driving at night and sleeping during the day, however, from my experience there are very few hotels that let people under 21 check-in. Since I am rushing back to Texas I don't know exactly where I'll be or at what time I'll stop for a hotel, all I know is that the trip will take 3.5 days at most so I will have to reserve the room last minute. I would probably have to check-in in the morning before noon and leave in the late afternoon or at night, so I was worried that even if I did find a hotel that took someone under 21 that they would either not let me check in or charge me double. If that is the case I would end up sleeping in my car. This situation isn't ideal for me but I don't have any choice.

Does anyone have a similar experience or any advice? Would the hotel workers be willing to make an exception? I appreciate any advice.",hotels,3,https://www.reddit.com/r/hotels/comments/12tqfvb/booking_hotels_last_minute_on_road_trip/
2023-04-20,1682019298,Potential Consequences of Cancelling Card After Booking Hotel on Priceline,"Hi, I recently booked a hotel through priceline.com and then found the same hotel at a lower price about 30 minutes later. At the time, priceline hadn't charged me yet, and my bank allows me to freely  dispose of and create new cards. So, I decided to dispose of the card  and cancel it. Now, priceline claims I still owe them the original  booking price, but they haven't charged me, and they won't be able to now since the card is cancelled.   
Does anyone know what potential  consequences I could face in this situation? Any advice or insight would  be greatly appreciated!",hotels,4,https://www.reddit.com/r/hotels/comments/12tckl7/potential_consequences_of_cancelling_card_after/
2023-04-20,1682001903,Wynn and Four Seasons employee grooming standards," HI all! I'm doings some research on major resort companies and the grooming standards they hold their employees to. Would any former or current employees of Four Seasons Hotels or Wynn Resorts be willing to share some information with me? I'm looking for specific information in these six categories: Dress code, tattoos, piercings, facial hair, and hairstyles/colors. Thank you!",hotels,0,https://www.reddit.com/r/hotels/comments/12t1ho4/wynn_and_four_seasons_employee_grooming_standards/
2023-04-20,1682000328,Planning to create a web app that uses Ai for the hotel industry,"Hey guys, I have been working on a web app that i believe will greatly benefit the reservation entry process for hotels and tour operators. If anyone has 2 minutes to spare to take this quick survey it would really help us! :)

[https://forms.gle/ZwWaw2w9cWw4Davs7](https://forms.gle/ZwWaw2w9cWw4Davs7)",hotels,4,https://www.reddit.com/r/hotels/comments/12t06li/planning_to_create_a_web_app_that_uses_ai_for_the/
2023-07-09,1688868764,"Choice Hotel, can't redeem points for a Suite?","I have a ton of points (180,000ish) from work travel before my company switched to Marriott, so now I am looking to burn them. Platinum tier, if that means anything. 

Decided to book a King Suite at the Oceanfront Ascend in Virginia, Beach but it's saying we can't use points for a suite. 

First, the term suite is used generously with Choice and now I can't even use points for it??

How can Choice be more restrictive than Marriott when it's a few pegs lower on the hotel totem pole?",hotels,4,https://www.reddit.com/r/hotels/comments/14um9qf/choice_hotel_cant_redeem_points_for_a_suite/
2023-07-08,1688804687,Is anyone here with a booking.com registration problem?,"[Booking.com](https://Booking.com) is not letting me register my property and giving something like ""500 server error"". And previously it was not approving my property. But now from a new account this problem i am facing. Is there anyone with the same issue? So how can i solve it?",hotels,1,https://www.reddit.com/r/hotels/comments/14ty83l/is_anyone_here_with_a_bookingcom_registration/
2023-07-08,1688787759,Tipping for picking up my bags?,Hi I just went to a trip to Vegas for a few days and after went to tour the grand Canyon for a couple days. I was able to store my luggage at the hotel and I tipped the person who stored my bags and took care of my luggage. When I pick my bags up am I supposed to tip again?,hotels,4,https://www.reddit.com/r/hotels/comments/14tsop9/tipping_for_picking_up_my_bags/
2023-07-07,1688771747,Widow Spiders,"Been staying on and off at an hotel in NC for a year.

I brought here a lot of my employees, having sometimes 15 people at the same time for 4 weeks or more.

Service level has been steadily declining, but we were hanging in there because it was a fairly new hotel and was very close to our facility.

In May I saw a widow spider (brown probably) in the stairs. Told the employee at the counter, then left for a few weeks.

Coming back to the hotel I go check on the spider and it's still there, with 10 egg sacs in tow.

I tell the counter again, showing the photos and explaining the location and then proceed to send an e-mail to the manager, asking to have pest control remove spider and eggs.

Manager does not answer to my mails and no one seems to care, what are my options in this situation? I would prefer to stay in this hotel because I would not want to drive 30 miles every morning and evening, but honestly I don't like the idea of sharing the hotel with thousands of widow spiders",hotels,5,https://www.reddit.com/r/hotels/comments/14tmr0j/widow_spiders/
2023-07-07,1688757277,"Get 25$ off any Hotel on Hopper app with jefferyt3ps under ""redeem a code"" in the Hopper App",You can't even get this discount anymore but I have an older version and am part of the partner program.,hotels,0,https://www.reddit.com/r/hotels/comments/14tggtb/get_25_off_any_hotel_on_hopper_app_with/
2023-07-06,1688676476,The hotel sent me booking cancellation by I didnt request it,"I need some advice on how to handle this situation, I am 1 week away from traveling to that destination and my air tickets a paid.
I attempted to book somewhere else but last minute booking is 1k more for me and my family",hotels,16,https://www.reddit.com/r/hotels/comments/14slblt/the_hotel_sent_me_booking_cancellation_by_i_didnt/
2023-07-06,1688618807,Ocean front apartment Queensland,"  

Blue Ocean Apartment is recently renovated with a large, modern open plan kitchen family area, main bedroom with ensuite and second bedroom with 2 single beds. Both bathrooms have also been given a contemporary makeover. The southern end of Palm Beach is an amazing place to stay and with a focus on young families and affordable water front holiday accommodation, Blue Ocean Apartment is a 5 star ***2 bedroom*** apartment loaded with all the extra's families with young children need as well as extras for the not so young, to make your holiday easy and relaxing. On entering the apartment you will immediately see holiday views of palms, beach, sand and surf. Opening the sliding doors lets the ocean sounds and the cool sea breeze fill the apartment giving you the feeling that you have arrived at your [beach holiday.](https://www.blueoceanapartment.com.au/gallery)",hotels,1,https://www.reddit.com/r/hotels/comments/14ry88e/ocean_front_apartment_queensland/
2023-07-06,1688603804,Hotel Tonight question?,"So I'm planning an overnight in New York City next weekend. Discovered Hotel Tonight and wow their prices are great. The problem is, there's 4 of us--and only one of the hotels they are showing me let me choose between 1 bed or 2 bed---all the rest say the hotel will select for me. If need be I'll wait until next weekend and book the one with the 2 beds (I think their prices go down night before). But I was wondering if when you book in advance, how long until you're able to find out your room info/room type? And are hotels open to switching you to 2 beds if its a hotel tonight reservation? (If requested right before check in, not too far in advance). Lastly, does anyone with Hotel Tonight experience know if they're flexible on refunds if its in advance? (since if I AM able to find out room type after booking in advance, would love to swap out if its 1 bed)",hotels,11,https://www.reddit.com/r/hotels/comments/14rsoc2/hotel_tonight_question/
2023-07-05,1688587599,Can we sue a Hotel in Washington DC?,"We have a contract and paid in advance 18 rooms. Once we arrived, they only had 13 rooms and it was 1am. They still have not reimburse me for the five rooms.

Sorry, yes they only had 13 rooms ready. 

I paid in advance about a month before our arrival, the whole reservation was for the 18 rooms.

There was a contract where they guaranteed the 18 rooms.",hotels,24,https://www.reddit.com/r/hotels/comments/14rlraa/can_we_sue_a_hotel_in_washington_dc/
2023-07-05,1688578875,Prepayment question,I just booked two rooms for my MIL and kids in November. I booked the prepay option because I am paying for the rooms and wanted to get it over with now. The reservation is in my MIL's name. I called the hotel and this is what they said to do. It'll be a week tomorrow and the charges still haven't appeared on my card. Any insight? Last time I did the prepay with a different hotel chain it was charged the instant  I hit book.,hotels,9,https://www.reddit.com/r/hotels/comments/14rhqjb/prepayment_question/
2023-07-05,1688564445,Roaches&,"How should this be handled?Booked a room for a few nights.  On the second night I saw a tiny bug and squished it. Subsequently, there have been a couple more, including a large one crawling out of the ice machine. Wasnt 100% sure what type of bugs the little ones were until seeing the adult version; they are cockroaches. We only have one more night. 

Do I let the front desk know? Do contact corporate? Am I entitled to a refund? 

A little background: we had rented a beachfront property, only to arrive and find it had not been cleaned between guests. That has been dealt with. There were no vacancies in the area so we took this room 20 minutes away and now this?!? I might just sleep in my car in the future. /s",hotels,14,https://www.reddit.com/r/hotels/comments/14rb0cd/roaches/
2023-07-04,1688510087,Hotels worth going to just for the room and food? Near new york state,"My husband and I just got back from our honeymoon at the pocono palace...while it was awesome to have a pool in our room, the bed was uncomfortable, food sucked, crappy tv and internet, etc. We did have an okay time overall, but i would like to plan something to redeem the trip lol. We are not social people and mainly want a great room we can really relax in, preferably with a private spa tub or hot tub. Room service with great food (not fancy, just good! Burgers and steak are perfect). Right now i am looking into staying at the seneca allegany or Seneca niagra casino resorts, but did see some bad reviews on the food and would like more suggestions.",hotels,1,https://www.reddit.com/r/hotels/comments/14qt3mr/hotels_worth_going_to_just_for_the_room_and_food/
2023-07-04,1688485070,Room faults,"Hi 

A question to hotel managers.

I have stayed in a lot of hotels the last year or so, some very nice, some not so.  Without fail, there is a fault in every room.  Not big stuff, but annoying little things like blown light bulbs, dripping showers, squeaky door hinges, no batteries in the TV remote, etc.

How do these normally get dealt with?  They can't be housekeeping jobs, they don't have the time.  There can't be a maintenance team going around to check things as this would be too expensive.  So, is the operating model really just to depend on guests to report these faults when they find them?

Intrigued, I am.

Thanks ",hotels,5,https://www.reddit.com/r/hotels/comments/14qiihj/room_faults/
2023-07-04,1688481897,Finding room types and distributions,"Hello Everyone!

 May you please help me with my hotel research, i would like to ask you how to find room types and their distributions. For example how many are single rooms and double rooms plus any additional tips i would be grateful for your help

FYI It is not one specific i am  asking for but multiple hotels

Thank you in advance ",hotels,2,https://www.reddit.com/r/hotels/comments/14qh50s/finding_room_types_and_distributions/
2023-07-04,1688457527,Help me guys, https://sharing.hopper.com/invite/destynia5gz,hotels,0,https://www.reddit.com/r/hotels/comments/14q8oud/help_me_guys/
2023-07-04,1688457466,Hopper link saves you $$, https://sharing.hopper.com/invite/destynia5gz,hotels,0,https://www.reddit.com/r/hotels/comments/14q8o84/hopper_link_saves_you/
2023-07-04,1688455382,9 Hotel revenue management strategies,"Here are some helpful examples and explanations below to help you better understand the many ways you can manage your hotel revenue. You can improve your financial outlook with each of these strategies and revenue management action plan.  
  
**1. Understand the Industry**  
Putting in a significant market focus is a vital revenue management tactic for hotels. Who exactly are you trying to reach? Where do they call home base? What do you think they want, need, and expect from you? How fierce is the opposition, exactly? In what ways could local variables affect demand over time? How does seasonality affect demand? Acquiring market knowledge is crucial for prudent decision-making when using effective revenue management tactics.  
  
**2. Optimization of market segments and prices**  
The answer to the question ""What is revenue management?"" should include discussion of price optimization. One strategy for doing so is called ""segmentation,"" in which your customer base is broken down into several ""types,"" their preferences and booking patterns are analyzed, and the prices they pay are optimized. You might, for example, offer discounted room rates to business travelers on the assumption that they will use other hotel services to make up the difference.  
  
**3. Align your various departments**  
One of the main steps is to think about how you can get the different hotel departments to work together and coordinate to implement your hotel revenue strategy. To accomplish this, you'll need to educate the department heads on the value of hotel revenue management and win them over. Help them fine-tune their methods if they need it, and make sure their documentation is accurate.  
  
**4. Find the most appropriate pricing method**  
Choosing the best pricing strategy at any given time is the key to good hotel revenue management. Hotels can make more money by charging more during peak seasons when occupancy rates are high, while in off-seasons, a discount pricing plan can help them sell rooms that might otherwise go unsold. Make sure your hotel revenue strategy makes sense and that you have room to maneuver.  
  
**5. Offering rewards for direct reservations**  
Answer to how to increase hotel revenue is to offer direct bookings. Hotel revenue management can benefit greatly from direct reservations because hotels keep all the money customers pay throughout the booking process. However, while OTAs do increase a hotel's exposure to potential guests, they also require a commission from each booking made through their site. So, you should offer perks like a loyalty program, free add-ons, and so on to encourage direct bookings.  
  
To read the whole blog visit this link: [https://www.quoality.com/blogs/hotel-revenue-management-strategies](https://www.quoality.com/blogs/hotel-revenue-management-strategies) ",hotels,1,https://www.reddit.com/r/hotels/comments/14q81ww/9_hotel_revenue_management_strategies/
2023-07-04,1688450063,Use my link so we can both save with hopper., https://sharing.hopper.com/invite/justinb4awq,hotels,0,https://www.reddit.com/r/hotels/comments/14q6f3y/use_my_link_so_we_can_both_save_with_hopper/
2023-07-04,1688444419,Is it legal for hotels to turn away locals?,"Tried to book a room near my house because my AC went out. Was turned away because of my local ID. It HAS to be illegal for someone to discriminate against geographical location, right? Any insight is appreciated.",hotels,18,https://www.reddit.com/r/hotels/comments/14q4m5u/is_it_legal_for_hotels_to_turn_away_locals/
2023-07-03,1688416082,"For you small hotels/Inns, what booking software do you use?","20 room hotel owner here and we use ""Little Hotelier"", which is good and we enjoy it. I'm just curious what others use. Also, credit card processing fees are so expensive.",hotels,2,https://www.reddit.com/r/hotels/comments/14ptu3u/for_you_small_hotelsinns_what_booking_software_do/
2023-07-03,1688413208,Noisy guests,So last night a new family moved in at the room next to ours and the are very loud in the middle of the night. They are jumping around and moving furnitures around and clearly doesn't care about keeping their voices down to a minimum. Is this is an acceptable behavior or am i just missing something regarding hotel rules?,hotels,5,https://www.reddit.com/r/hotels/comments/14psmwi/noisy_guests/
