date_utc,timestamp,title,text,subreddit,comments,url
2023-07-10,1689026577,Non refundable room and problems with bathroom and balcony/view,"I booked an accomodation in Croatia for 2 persons over booking.com.

In the property information it says ""Double room with balcony"" and the facilities include private bathroom. However the area of the room is stated as 12 square meters. The room is not refundable. The review rate is 8.8. 

A day after I booked the room, I received a welcome message from the host. Among other stuff it informed me that the room does have a private bathroom, but it's located outside the room, basically next door. You have to get out of the room, walk 10 meters in a shared area and you find your bathroom.

Today we arrived and saw the room and basically liked it, other than the bathroom situation.

We also saw that the room itself doesn't have a balcony or any sea view. There's a shared terrace among all rooms, with a sea view and also a shared kitchen.

We're okay with all this, but we feel that the info and facilities page about the room didn't tell the whole truth. About the bathroom, the balcony and the view.

Yes, I understand that one can deduce from the size of the room that it can't have a bathroom ensuite, but I'd prefer to have it written clearly. Also, when I read room with a balcony and sea view, I tend to think that these features are for the room and not shared. Is it me being weird/naive?

Another thing: Seems that the host sends to every guest this informative message about the bathroom after they booked the *non refundable* room. Wouldn't it be easier to just write it in the room informations? Looks a bit like a red flag.

We will keep the room and enjoy our few days vacation. No huge deal from our side. Just trying to understand and learn from the situation.

Thank you!",hotels,3,https://www.reddit.com/r/hotels/comments/14w7wwq/non_refundable_room_and_problems_with_bathroom/
2023-07-10,1688950331,Booking a 2 bed room with 3 people,Ok I'm staying in a room with two beds. Would it be ok if I put down for 2 people but have 3 people in total stay but not all at the same time. I have one fun who'll stay one night with me and another for 1 to two nights. I will stay all nights as the primary booker. So is that ok to do?,hotels,2,https://www.reddit.com/r/hotels/comments/14vf7y6/booking_a_2_bed_room_with_3_people/
2023-07-09,1688941383,Is stay for less legit?,Is stayforless.com legit?,hotels,9,https://www.reddit.com/r/hotels/comments/14vbra4/is_stay_for_less_legit/
2023-07-09,1688906448,Hotel put a incidental fee hold on me twice? Is this normal?,"So I know that hotels will hold $40-50 on your credit card in case there are any damages to your room during your stay. I traveled last month and when I checked into the hotel and gave the receptionist my card, I got the $40 hold immediately. A few days after the trip, the hold was dropped and gone from my credit card. About a month later, the charge is BACK? Im not sure why. Has this happened before to anyone else? Is this normal?",hotels,2,https://www.reddit.com/r/hotels/comments/14uxlv2/hotel_put_a_incidental_fee_hold_on_me_twice_is/
2023-09-13,1694578272,Can I walk in and get a hotel room 5-6 in the morning?,"I'm in a situation where I have to drop off family at an airport early in the morning. My flight does not leave until 7:30 pm, so I have about 10 hours to spend. I was thinking about checking into the hotel for the day and leaving for my flight that evening. How does the pricing for that work? Do i have to pay for the night before to the night next day? That seems a little too expensive for only staying there 10 hours...

If anybody has insight into this it would be greatly appreciated.",hotels,7,https://www.reddit.com/r/hotels/comments/16hcyzn/can_i_walk_in_and_get_a_hotel_room_56_in_the/
2023-09-13,1694568822,Talk smack about us and our hotel? Were talking about you for at least 48 hours.,"As a hotel receptionist, Im the hub of all communications. Whether that be with Head Office (Head honchos), Central Reservations, or Third-party companies, they all call me.

I also deal with complaints&

Talk smack about the hotel? The food? The service? The area? Just know were all talking smack about you. Never coming back? Good, I dont want to have to deal with you again.

Some hotels have a system where they can Blacklist you from their premises. If its a small group and try to be funny and book there, pahahaha have fun.

Local hotels will also have a group chat to warn their competitors about thieves, abusive guests and Black-listed guests. Love a general area? been abusive? Again, have fun trying to book your 3-day staycation",hotels,10,https://www.reddit.com/r/hotels/comments/16h9n39/talk_smack_about_us_and_our_hotel_were_talking/
2023-09-12,1694558649,Is there any way for me to have a live update on my hotel rates,"Hi,  was wondering if there's a way for me to have a live update on the rates of multiple hotels, as my family owns 8 and checking all 8 is just tedious.",hotels,12,https://www.reddit.com/r/hotels/comments/16h5o6w/is_there_any_way_for_me_to_have_a_live_update_on/
2023-09-12,1694496572,Affordable luxury rentals palm beach,"The southern end of Palm Beach offers easy access to Palm Beach Parklands, a spectacularly beautiful coastal beach and tidal lagoon environment, that streches back from the southern end of Palm Beach along the Currumbin Estuary taking in the Currumbin River and Lagoon, and is located a short 300 metre parkland stroll from Blue Ocean Apartment.  
  
Palm Beach Parklands has benefited from considerable embelishments over the last 18 months which has transformed this already beautiful natural beach and river environment into a magnificent family friendly parkland area that is now arguably the best beach spot on the Gold Coast. There are so many options for you and your family to connect with the ocean, from walking trails that take in endless beaches, calm water safe swimming areas for children, funky gazebo's perched on the waters edge, riverbank bush reserves, wildlife sanctuary's, river board walks, open parkland areas, exercise points, sand dunes and rock wall features.  
  
Currumbin lagoon also offers great sheltered swimming and has an open grassed parkland area with a pirate play ground providing endless entertainment for the kids along with the "" Dune Cafe "" next door for that much needed coffee break.  This is in addition to the open spaces and a nature reserve with many secluded white sandy, calm water beaches with picture perfect picnic spots on the waters edge making the southern end of Palm Beach the best waterfront spot on the whole of the Gold Coast.  
  
Palm Beach on the Gold Coast is located a short 7 minute drive north of the Gold Coast Airport with public transport to Blue Ocean Apartment stopping directly in front of the building saving you the 1 hour plus courtesy bus treck to Surface Paradise after your flight to the Gold Coast. Palm Beach also benefits from having the freeway passing through the western side of the suburb providing quick and easy access from Blue Ocean Apartment to the Theme Parks and other Gold Coast attractions.",hotels,0,https://www.reddit.com/r/hotels/comments/16giq3t/affordable_luxury_rentals_palm_beach/
2023-09-12,1694487331,Hotel Branded Products,"Just a quick question for any hotel employees here (or guests, if you happen to know).

Does your hotel sell any branded products? And if so what are they? Also, are they sold from the hotel directly or through a third party (online, etc)?",hotels,7,https://www.reddit.com/r/hotels/comments/16gfqtv/hotel_branded_products/
2023-09-12,1694480070,My new hotel job?,"So I recently got a new hotel job as front desk associate and the manager likes to complain about past employees and we use paper time clock sheets and get paper checks. I've only worked at 3 hotels total, but is this normal?
He also fired everyone making 14/14.50 an hour and cut the pay down to 12.75/hr and doesn't train us aside from giving us interactive courses online, and then gets mad when we screw up because we weren't properly trained. They're already disparaging of a new hire because she made mistakes, because she wasn't thoroughly trained for night audit. 
Is this at all normal in the hotel industry or am I hallucinating? I would try to get a job in another hotel nearby but most of them are owned by the company I quit working for and I think they probably won't hire me again with the way I quit. I've tried applying. Nothing. And a lot of hotels don't accept piercing wearers or guys with earrings.",hotels,7,https://www.reddit.com/r/hotels/comments/16gd2mw/my_new_hotel_job/
2023-09-11,1694414257,Management,"I applied to one of the hotels for a management position such as a supervisor Duty manager in whatsoever little did I know I got excepted as a front office manager so I did the interview and everything went all right but now I am really confused because when I got to the position when I got to my office I noticed there are people with high experience working under me. Now Im not saying Im not worthy of the job, but why did he pick me and did not pick these people this is very confusing. They have a lot of expertise. They used to be managers in previous hotels and now they have positions lower than me and I have never been a front office manager. I was in charge of the front office once but not as a manager directly",hotels,5,https://www.reddit.com/r/hotels/comments/16fo434/management/
2023-09-10,1694374842,Hotels,"If I am meeting someone at a hotel but whyre paying for it, do I have to show ID? Can I just walk straight up into the room?",hotels,4,https://www.reddit.com/r/hotels/comments/16f9hz0/hotels/
2023-09-08,1694201508,"American native, are there opportunities to work abroad in this industry?","I am about to graduate with a degree in international business and a minor in Spanish, and Ive been working as a front desk agent (2nd shift) and doing night audit as well when needed for about a year now at Hilton. I was wondering if there are any opportunities abroad in the industry and where I should start?",hotels,3,https://www.reddit.com/r/hotels/comments/16djsm5/american_native_are_there_opportunities_to_work/
2023-09-08,1694196052,Left Hotel Due to Terrible Smell but was Still Charged,"I booked in advance via Expedia and checked into a cheap ($120) 3-star hotel with an old antebellum vibe. The place smelled heavily of febreeze, like worse than when I closed down bars and mopped and cleaned the bathrooms with chemicals. We tried to air it out for 30 min and then decided to leave. My kids hair smelled like febreeze the next morning, so Im glad we got out of there, but the hotel is refusing to refund our money. Is there anything I can do?",hotels,6,https://www.reddit.com/r/hotels/comments/16dhgu1/left_hotel_due_to_terrible_smell_but_was_still/
2023-09-08,1694195172,Where to post front desk jobs?,"Hi Hive mind, 
Front desk folk, where do you look when looking for a new job? we've used Cool works with limited success. Anybody have a better or alternative site?  Thanks!",hotels,8,https://www.reddit.com/r/hotels/comments/16dh3mf/where_to_post_front_desk_jobs/
2023-09-08,1694176557,Do not go to Istanbul Villa Pera Suites Hotel,"

The hotel wasnt clean, stained towels/bedding, Misleading photos, and the bathroom smells strongly of mold. On day 2 we realized there was bed bugs. We were covered in bites, found the sheddings, eggs and adult bugs. We called the staff showed them the issue. They tried to deny it was bed bugs. Claimed it was impossible because they spray the mattresses (not how you get rid of bed bugs.) And it was like pulling teeth to get a different room and to get them to launder our now contaiminated clothes. Horrible management. They moved us to the room right below the contaiminated room and 1 day later we could hear that another guest was in that room. They clearly did not take any reasonable precautions and were argumentative and irresponsible. Honestly horrific experience that I wouldnt wish on my worst enemy.",hotels,1,https://www.reddit.com/r/hotels/comments/16d9et4/do_not_go_to_istanbul_villa_pera_suites_hotel/
2023-09-08,1694161799,What OTAs Do Hotels Prefer?,"It seems that booking directly with the hotel is the most expensive. [Hotels.com](https://Hotels.com), [Booking.com](https://Booking.com), [Trivago.com](https://Trivago.com), [Priceline.com](https://Priceline.com), or [Hotwire.com](https://Hotwire.com) are all $10.00-$30.00 cheaper.  What do hotels generally advise? 

I got out from behind the desk over thirty years ago; the only outside agency we had was our franchiser.  I'm lost, now.  If you had to make a reservation outside your chain, how would you do It?",hotels,30,https://www.reddit.com/r/hotels/comments/16d4vbl/what_otas_do_hotels_prefer/
2023-09-07,1694118316,How can I search for hotels with large bathtubs?,Ive been trying different key words and sites for over an hour now and Im just not getting it. Any hotels (US) that come standard with large tubs?,hotels,4,https://www.reddit.com/r/hotels/comments/16cpdre/how_can_i_search_for_hotels_with_large_bathtubs/
2023-09-07,1694117551,Need a quiet place for a zoom meeting in the middle of the day.,"I do construction consulting. Im going to be visiting a couple job sites next Friday, but in between sites I need to do a zoom call with a prospective client. I would normally just get a hotel room, but the problem is that this is going to be in the middle of the day. The meeting is at 11:00 and could go more than an hour. Do hotels have any type of accommodation for something like this? Either a really early check in or a really late check out that I could guarantee at booking? Or just rent a conference room for a couple hours?

Any ideas or insight would be great. I just need to be in a somewhat professional setting without the chance of being interrupted.",hotels,6,https://www.reddit.com/r/hotels/comments/16cp0wv/need_a_quiet_place_for_a_zoom_meeting_in_the/
2023-09-07,1694114869,Over qualified for on can banquet setting?,I applied for an on call job but got rejected very quickly. I'm comfortable working weekends and holidays as needed [I'm especially available during holidays] and I have 2 years of direct experience out of an overall 6 years in hospitality. However I work full time as an engineer and I'm thinking this makes the hiring at the hotel think I'm over qualified for the job. I'd this an omnidirectional red flag in hotel hiring?,hotels,2,https://www.reddit.com/r/hotels/comments/16cntn4/over_qualified_for_on_can_banquet_setting/
2023-09-07,1694103568,Hotel scavenger hunt,What are the wildest things you have found left behind in hotel rooms.,hotels,8,https://www.reddit.com/r/hotels/comments/16ck1np/hotel_scavenger_hunt/
2023-09-07,1694084306,Check in/out confirmation,"Over the weekend we had a family emergency and were unable to show up for a hotel reservation. I received an email confirming a check in and check out time (very late at night, very early in the morning). Should I be concerned that someone else checked in using our reservation? Is it typical for hotels to mark the room as reserved since guests did not show up? Or should I received an email confirming our no show?",hotels,2,https://www.reddit.com/r/hotels/comments/16ccssb/check_inout_confirmation/
2023-09-07,1694064405,Hotel prices in nyc,"Hi!

I was trying to look for either a room of 2 beds or 2 rooms next week in nyc within an affordable range (at most $200/night). A very last minute decision which I now regret after seeing the price boost of hotels in NYC (even in Brooklyn). I am wondering what can be the reason for the prices getting this high considering summer is ending and kids' schools have started? I wish I would have booked something earlier.",hotels,5,https://www.reddit.com/r/hotels/comments/16c7cuc/hotel_prices_in_nyc/
2023-09-06,1694017262,Hospital ned/handicap accessible,"Hello! I am trying to plan accommodations for my grandmother who uses a walker/wheelchair and sleeps in a hospital bed to help her get in/out and to prop her legs up while she sleeps. She is also incontinent, so she uses diapers/puts pads down. Google searches have not been very helpful, but does anyone know if particular hotel chains offer rooms with hospital beds or what I should be looking for?

She'd like to attend a wedding around Charlotte, NC if that helps. Thanks in advance!",hotels,7,https://www.reddit.com/r/hotels/comments/16bok9v/hospital_nedhandicap_accessible/
2023-09-05,1693953278,Need to know where Hilton buys their pillows,"Hi, do you know where we can purchase the same pillows that Hilton uses in their hotels? 

We were on vacation recently, and stayed at a Hilton. My wife loved the pillows and wants to get some just like them. 

I looked for her, and found some on Amazon that supposedly were hotel quality with high ratings and ordered them. They are not near as good as the Hilton ones.",hotels,3,https://www.reddit.com/r/hotels/comments/16b2lnl/need_to_know_where_hilton_buys_their_pillows/
2023-09-05,1693951784,Opera Cloud giftcard system?,"My hotel has transitioned to Opera Cloud last year and we are trying to find a giftcard system that integrates.  So far we have found none that fully integrate with Opera Cloud.  Givex does this half-assed approach we aren't excited about.

Anybody use a fully Opera Cloud integrated giftcard system at their hotel?

Thanks for any feedback",hotels,1,https://www.reddit.com/r/hotels/comments/16b1xth/opera_cloud_giftcard_system/
2023-09-05,1693941653,need some help,so i was trying to have some fun time with this girl and she knew the owner of the hotel and we decided to pay him so he could get a cheaper price on a room but then a bunch of things came inbetween and we coudnt but from what he told me he didnt put down a date for the room and is now being fined for 1000 euros is this something that he can do? ,hotels,6,https://www.reddit.com/r/hotels/comments/16axbtw/need_some_help/
2023-09-05,1693939014,Why do so many new hotels have glass doors or windows in the bathrooms? Seems like the privacy level is so much lower than it used to be.,Was recently in Amsterdam (Kimpton) and Paris (Renaissance) and both hotels had either glass door or the whole bathroom was a glass box (with curtain). ,hotels,4,https://www.reddit.com/r/hotels/comments/16aw6vn/why_do_so_many_new_hotels_have_glass_doors_or/
2023-09-05,1693938824,Which hotel or company has the best online/mobile check-in?,"We know there's a few out there: Hilton, Marriott, MGM, etc - but who do you think has the best online mobile check-in?

&amp;#x200B;",hotels,3,https://www.reddit.com/r/hotels/comments/16aw417/which_hotel_or_company_has_the_best_onlinemobile/
2023-09-05,1693937059,"Can you leave light on in hotel or motel room, or does it look weird?",I'm autistic and I wonder you can leave light on in hotel or motel room while you're out doing something visit in town or city.,hotels,7,https://www.reddit.com/r/hotels/comments/16avcvf/can_you_leave_light_on_in_hotel_or_motel_room_or/
2023-09-05,1693894906,"I believe I left my chain a hotel, I called yesterday and today they reported that I never checked it when I did. How odd what do you guys suggest I do! Please help.",,hotels,8,https://www.reddit.com/r/hotels/comments/16aga93/i_believe_i_left_my_chain_a_hotel_i_called/
2023-09-05,1693886287,Which hotel is the best to work for for benefits &amp; perks?,,hotels,4,https://www.reddit.com/r/hotels/comments/16adl0a/which_hotel_is_the_best_to_work_for_for_benefits/
2023-09-05,1693880420,Looking for true opinion,"Hello folks, my and friend and me are bootstrapping and planning to start mostly a cloud kitchen which later will be changed to a dine in place. 
My question is if there is a place which serves  poutine with different sauces along with well cooked chicken and baked potato served all day long. How many would love it or dont. Any tips, pointers and words of wisdom are welcome",hotels,4,https://www.reddit.com/r/hotels/comments/16abkne/looking_for_true_opinion/
2023-09-04,1693863465,Can you check in with a photo of your passport?,,hotels,4,https://www.reddit.com/r/hotels/comments/16a4wa2/can_you_check_in_with_a_photo_of_your_passport/
2023-09-04,1693851334,Review of horrible Hyatt fishermans wharf experience,"I had a very disappointing experience with the Hyatt  Fisherman's Wharf. They failed to provide transparent information about fees and taxes, which was frustrating. Their customer service was extremely poor, they were rude even just trying to explain the fees to me. I was put on hold for an excessive 30 minutes after being transferred to a manager, only to have the call eventually disconnected. They also felt the need to call the room and aggressively ask why we had issues with the fees, the young lady said""the fees are the fees!""  This experience has left me deeply dissatisfied with Hyatt and I wouldn't stay there, nor recommend this hotel to anyone else even if they paid me a million llamas.",hotels,7,https://www.reddit.com/r/hotels/comments/169zf3w/review_of_horrible_hyatt_fishermans_wharf/
2023-09-04,1693827778,Billing in hotel,"Streamline your hotel's operations with Best Hotel Management Software. This software is designed to automate hotel daily basis tasks including billing dashboard, staff management, guest records, gym management, and customers.  
  
",hotels,4,https://www.reddit.com/r/hotels/comments/169psrl/billing_in_hotel/
2023-09-03,1693710609,Deplorable experience,"Comfort Inn and Suites Harvey, La

This location is a deplorable representation of your brand. If we had not already driven out of our way to stay in a brand that we are used to being totally satisfied with in the past and hadnt just driven 8 hours to get to, we wouldve walked out. 

First off on the walk to our room we are greeted to a whole stretch of hallway with ceiling tiles missing because of an apparent water leak. The hallway reeked of a mixture of bleach and mildew from said water leak. A huge trash can is blocking the hallway catching water and gives you a nice unavoidable splash as you walk by. We are well aware that things happen but this clearly isnt the way to handle the situation and a simple apology for the state of the hallway would go far.

Then we enter the room and the mildew/mold smell continues with the addition of smoke in a non smoking hotel. We are traveling with in-laws and our infant daughter.  We go to turn the tv on and neither tv is working. Try all the inputs and nothing works.  There are two tvs controlled by one remote.  When trying to call the front desk we realized the phone does not work. So I made my way to the desk to be told that none of the phones work in any of the rooms. They did have someone come in and check everything and he did get everything working, albeit aggravated having to come and do it. 

Several outlets were not working and had to pull out the night stand and there was about an inch of dust behind it so we could test the outlets.  Sleeping with a cpap machine because of obstructive sleep apnea makes having power outlets that function essential.  

There was no place in the closet to hang our clothes, because it was completely empty as if it has been stripped. 


We had made a reservation for the suite because we needed the extra hideaway couch for a bed. For one there were no additional linens. Upon opening the couch I decided to not use the disgusting mattress, and figured I would just sleep on the couch. When trying to return the cushions on the bed, we saw unmentionable stains on the cushions so they had to be returned in a way that we could avoid those stains. Instead of using the blankets to cover up with I used them to avoid touching the couch at all. Makes for a lovely nights sleep.

One of the selling points of the Comfort Inn/Suites brand is the good hot breakfast. By 7am the syrup was empty and they were completely out of butter. The mini fridge was completely empty except for a small amount of cream cheese, therefore no yogurt or coffee creamer. The only bread option was plain bread or a bagel. Clearly they are not prepared for anyone to be eating any breakfast. 

The ice maker didnt work on the first floor and were told we had to go to the fourth floor, because that was the only ice machine working in the building. We waited for 5 minutes and only got a few clumps of ice we didnt even trust to use for anyone to drink. 

Then the elevator appeared to keep getting stuck between floors three and four and would finally get down to the first floor after a few tries.  

It was shocking knowing the level of service your brand has given in the past to come into this motel.  They say you get what you pay for, but for almost $200 for one night, we definitely paid for a $50 hotel. We have exclusively used your brand for years. In fact a couple summers ago we spend two weeks at a different Choice Hotel every night and had impeccable service. The service we received in the last 48 hours was utterly deplorable and I wouldnt want my brand tied to that horrid level of service.",hotels,3,https://www.reddit.com/r/hotels/comments/168lxnx/deplorable_experience/
2023-09-02,1693675981,"How do hotels monitor their visitors count, and how many rooms are occupied?","I would like to know how hotels know how their rooms, and halls(if they have them) are occupied. 

Other than ofcourse, the staff being there to monitor, how can the management monitor the number of rooms and halls occupied remotely?",hotels,11,https://www.reddit.com/r/hotels/comments/1688i08/how_do_hotels_monitor_their_visitors_count_and/
