date_utc,timestamp,title,text,subreddit,comments,url
2023-09-19,1695139337,"Rewards and points, how do you deal with them?","I work in a Marriott hotel, most of our guests are there on business.  I noticed a few of them (believe me, I shudder every time I see their name in the arrival list) who pay with their business credit card, so obviously their companies pay for their stay.

They always find reasons to complain, it is usually something stupid that could have been fixed quickly if they had told us, and then they ask for extra points as a compentensation for their ""trouble"".  If they don't get it, they will complain directly to corporate and we will have to take care of it.

They are clearly looking tp pay for their vacations using the points the points they squeezed out of hotels.  For some of them, this behavior is so obvious and this is disgusting.  It's not like those points are free for the hotel.  

During the pendemic, one of them asked to be given the equivalent of a one night stay in points because the room was not cleaned on the second day of their two night trip.  They were warned about that policy when they reserved.  The bill in points for that from corporate would have been over $200 usd.  I told them I could not give them that amount of points, but I would gladly offer them a complimentary two nights stay in our hotel.  I knew they would refuse and they ended up accepting a significantly lower amount of points.

How do you deal with those situations?",hotels,6,https://www.reddit.com/r/hotels/comments/16muwxu/rewards_and_points_how_do_you_deal_with_them/
2023-09-18,1695051247,The park ave noth in new york usa,https://worldkidstravel.com/the-park-ave-north-in-new-york-city-usa/,hotels,0,https://www.reddit.com/r/hotels/comments/16lyr0o/the_park_ave_noth_in_new_york_usa/
2023-09-18,1695019924,"UPDATE: My new hotel job, pt. 2","So a little backstory. At my hotel there are 2 computers for front desk, the ""admin"" computer and the one he recommends we use. Which we do because it's so much easier to check people in.

Shortly after clocking in one day I decided to see if anything interesting was going on on the admin computer. The owner's wife doesn't care if we use it, but it's a very particular machine.

I opened Edge and was looking at the home page (msn or something similar) when I noticed one of the search results simply said ""porn"". I was like, um....Amber? Did you know about this?

Turns out from the timestamps this person looked up porn multiple times at like 3 am, and one time they went to a religious temple site immediately afterwards, a very specific one not many people would visit. I told Amber (owner's wife) and screenshotted it for evidence, but I think it was her husband, the owner, my boss looking at it, because at that time there is usually only one person manning the desk, and well, most of my coworkers and myself hadn't been hired yet when it was being viewed.  

I feel really uncomfortable knowing this and working there. Also why use a work computer for that? I feel like the majority of people know better than to do that. But tbf the owner and his wife are older and not super tech literate. 

The big question is, how do I respond otherwise to this and do I talk to corporate about this misuse of company property? I know we're a franchise and not owned by the company proper. Who do I talk to about this?

Edit: The boss also leaves fake reviews under his name on review sites to inflate the ratings.",hotels,7,https://www.reddit.com/r/hotels/comments/16lo832/update_my_new_hotel_job_pt_2/
2023-09-17,1694953812,Homewood Suites Panama City Beach - Unraveling the Pool Mystery,,hotels,0,https://www.reddit.com/r/hotels/comments/16kzgt5/homewood_suites_panama_city_beach_unraveling_the/
2023-09-17,1694953170,Pegasos world,im just ehre to aks if anyone who has been to this hotel in antalya turkey if you felt like you could now relax because there were too many children. im just asking if my mom would have a good time there she is worried there are gona be too many children in the dining places and stuff,hotels,0,https://www.reddit.com/r/hotels/comments/16kz9b8/pegasos_world/
2023-09-16,1694879738,"Brother wants to change his career from a hotelier to something else, but is unsure how or where to go","As you read, my brother(31M) wants to change his career from being a hotelier to something else, since he can't bear the workload (normal shifts go from 12- 15hrs a day, with the contract saying duration of the shift lasts as per the work demands). He is extremely tired and frustrated with his job, and does not feel he is happy there. Since he has studied humanities and graduated from a IHM, he only knows things around that. Since he is the sole bread winner of the house, he can't even quit without a worry to find a different field to work in. Can somebody suggest me what he should do with his educational background to work a job less demanding but with around equal pay? (Earns around 85k rupees/month)",hotels,3,https://www.reddit.com/r/hotels/comments/16kax8u/brother_wants_to_change_his_career_from_a/
2023-09-16,1694852203,Ive never been more terrified.,"Chattanooga, Tennessee. Stayed in the hotel room for no more than 30 minutes before we decided to leave to the hotel directly behind us. Ive been to cleaner and more up to date motels for less money. This hotel was something straight out of the back rooms. I dont believe the building was real. The carpet, wet. Brown stains that were.. hard to walk on..? Towels, damp. Water. Stains. Everywhere. Ceiling and walls peeling. The smell was overwhelmingly moldy. It felt wet and wrong to breathe. Flooring torn up. Hair on the bedding. Paced the hotel from 1:45-2:30am with no luck finding anyone. I called the front desk phone 3 times and listened to it ring next to me in the lobby. Rang the doorbell? Walked into employee only areas. I think I was maybe 1/3 people staying there, but not a single employee to be found. I understand customer service and I know how hard a job can be when its unemployed, but to be missing for 45 minutes is next level for my patience. I left.Ill check out in the morning.",hotels,4,https://www.reddit.com/r/hotels/comments/16k1z9t/ive_never_been_more_terrified/
2023-09-16,1694830104,"Advice needed from GMs, AGMs, and other hotel management staff","What advice do you have for dealing with excessive call-offs? Where do you draw the line between excused and unexcused absences? I struggle finding that balance with my team. A lot of them are struggling single moms or are living paycheck to paycheck and are just doing the best they can, and I truly feel for them. Im doing the best I can to continue to keep my hotel together and pulling more hours than anyone should, but sometimes its my staffs inability to keep their lives together that really ruin this job for me and constantly makes me consider leaving this field.

UPDATE: I want to thank everyone who took the time to respond. I utilized all the information to create an official call-off/attendance policy document that fit best for my team. It really came down to a lack of transparency on the policy, and this will help hold me and my team accountable. I actually sent the document to my VP of Operations for approval, and she said she was trying to convince her boss to get this going so all the GMs can be on the same page. This actually started the company getting an official document started. Appreciate you all!!",hotels,6,https://www.reddit.com/r/hotels/comments/16jvm75/advice_needed_from_gms_agms_and_other_hotel/
2023-09-15,1694779072,Best CRM for a hotel?,,hotels,0,https://www.reddit.com/r/hotels/comments/16jbbi0/best_crm_for_a_hotel/
2023-09-15,1694753698,"Hotel Suppliers (Cleaning Supplies, Amenities, etc.)","Hello all!

I'm starting a new position and I see that the sourcing team hasn't really researched any alternatives for quite some time. I wanted to see if there were any recommendations for food service suppliers / hotel amenitity / equipment suppliers? Any distributors that service Florida would be a bonus. Thanks for your help!  
  
",hotels,5,https://www.reddit.com/r/hotels/comments/16j42a0/hotel_suppliers_cleaning_supplies_amenities_etc/
2023-09-15,1694742761,Internet advice,"

Im currently staying at a Home 2 Suites in Las Vegas for a work trip. Im here for 2 weeks. Being a gamer, I decided to bring my Xbox to entertain myself during down time. The hotel offers free Wi-Fi, but its waaaay too slow to be able to play anything online. There is an Ethernet port that is currently connected to the tv in the room. I used the cable that I brought to get a wired connection for my console(after unplugging the cable going to the tv), and it turns out that the speed is remarkably fast. 

My question is, if I continue to use this connection, is the hotel going to charge me? I only ask because Im using a company credit card to pay for the room, and I dont want a surprise charge at the end of my 2 week stay.",hotels,4,https://www.reddit.com/r/hotels/comments/16j0hwe/internet_advice/
2023-09-14,1694719040,can you usually add another person to the reservation for check in?,"Friend and I are traveling to Canada together. Booked hotel room under friends name as we are using her credit card. However as we are making travel arrangements it seems that I will arrive first. 

Can my friend call the hotel and add my name to the reservation or just make a note that Ill be checking in?",hotels,6,https://www.reddit.com/r/hotels/comments/16ir6u5/can_you_usually_add_another_person_to_the/
2023-09-14,1694656222,The Plaza,"After seeing the Eloise movies, I wanted to put the plaza on my (o.k. not realistic but fun to dream) bucket list, but some reviews say it's overrated.  Has anyone here been? What do you think?",hotels,11,https://www.reddit.com/r/hotels/comments/16i5jpr/the_plaza/
2023-09-13,1694638145,Will a hotel generally warn guests to not come when theres a hurricane in the area?,"I booked a hotel in Maine before Hurricane Lee became a thing. Of course I will keep track of the weather and use my judgment but should I also expect a notification on my phone, telling me to cancel/reschedule my stay, should my destination area/hotel get hit? Or some sort of notification? 

Or would I have to do everything myself? Thanks.",hotels,7,https://www.reddit.com/r/hotels/comments/16hyehl/will_a_hotel_generally_warn_guests_to_not_come/
2023-09-13,1694634945,Hotel TV personal start up page AND cast solutions (SAMSUNG SMART TV),"Hello,

Im currently working to open a hotel and for the tv's i would like to open the tv with a welcome message, a instruction to go to live television and an option to select: cast to this certain tv with your own smartphone.

\*\*\*\*Where did i see this:\*\*\*\*A hotel in Scotland (hotelchain) used a software called Nevaya and it worked on an Samsung tv.The TV only showed a welcome page, time, options underneath to select live tv and a cast page. Cast page showed instructions how to cast to this certain tv.

\*\*\*\*What are the issues:\*\*\*\*To cast to a tv you need to be connected with the same network as the chromecast. That means that you can also cast to the neighbours tv. I know i can make 12 seperate wifi (vlan) names with it needs to be less complicated.

\*\*\*\*What's to do already:\*\*\*\*Samsung smart tv's can be unlocked with the code: Mute - 1 -1 - 9 - enter. It opens an menu where you can select hospitality mode. In this mode you can turn off certain functions plus change input devices as start up. (chromecast for instance).*I could use a android hdmi device but i dont like the reliabilty of that.I*Im not sure if you can select: open an url as a start up page but it would be something to show a personal hotel page. Plus i dont want guests to change the tv settings.

\*\*\*\*What can it cost:\*\*\*\*For only 12 tv's a subscription plan is something that i dont like. I understand that certain functions costs money but there's always a different way to tackle this.

Curious about hearing your opinions and expertese of some Redditors",hotels,1,https://www.reddit.com/r/hotels/comments/16hx12u/hotel_tv_personal_start_up_page_and_cast/
2023-09-13,1694627987,A question,"Hello everyone  
So basically I am from Egypt and I have a gf from Europe and I wanted to meet with her in a hotel in Marsa Alam but last time we met it was in Hurghada and she was with her family and they all had a room by themselves and I booked a room for myself (knowing that the hotel was for couples and families only) and after I went there they told me that my room is single for a single person -and if you're asking why I didn't book a room with her it was cause she came with her family according to a trip- and that I can't have anyone in my room but I thought it wasn't THAT serious after that me and her went to my room to put my bags and stuff after I got the room and then the security knocked on my door and told me we have been watching you on cameras and took me down and made me sign a contract not to have anyone in my room nor go to anyone's room (even tho her parents knew she was with me and they were fine with that and she was as well but they didn't even ask them) but allowed me to meet in public areas and do anything else but the room and the hotel was treating the foreginers way different than the Egyptians, they had their own restaurant and they didn't allow me in with her, they didn't allow me to go in the aqua park with her and I kept getting followed and being stalked the whole time and so and so  
So I am looking for a hotel in Marsa Alam where I won't face the same problem again, anyone got any recommendations?",hotels,10,https://www.reddit.com/r/hotels/comments/16htz5b/a_question/
2023-11-14,1699960983,"Hospitality, a Unique Investment","Hospitality represents a thriving sector, both in France and internationally. The growing demand for accommodation presents numerous investment opportunities.  
  
This investment stands out in several ways. Firstly, it is a real estate asset generating regular rental income. Hotels are leased year-round, ensuring stable rents for investors.  
  
Furthermore, hospitality can yield significant capital gains. The dynamic hotel market allows for a rapid increase in asset prices.  
  
Lastly, it is a diversified investment, with a variety of hotels offering unique characteristics and investment opportunities.  
  
References   
  
According to a study by the National Hotel Federation (FNH), the French hotel sector recorded a growth of 5.5% in 2022.  
  
According to a study by the World Bank, the global hotel market is expected to reach $1 trillion by 2030.  
  
Conclusion   
  
Hospitality is a unique investment that offers multiple advantages. As a real estate asset, it generates regular rental income, significant capital gains, and allows for portfolio diversification.  
",hotels,0,https://www.reddit.com/r/hotels/comments/17v06uo/hospitality_a_unique_investment/
2023-11-14,1699946737,Which hotel should I book for Tokyo? Grand Hyatt vs. The Okura,"I have narrowed it down to two hotels. I like them both and so I came up with some highlights  


# Grand Hyatt

**Highlights:**  
\- I can start working my way towards status with Hyatt. This would be 11 nights worth  
\- The location, based on what I've read, is good  


# The Okura

**Highlights:**

\- Slightly more expensive than the Grand Hyatt  
\- It's a japanese owned hotel so outside of Japan there's no usable loyalty or status I can accrue.  
\- Less western from what I hear so I suppose more authentic relatively speaking
\- The location is good, but slightly less than the Grand Hyatt, based on what I've read.  
\- slightly bigger in terms of square footage  


Any other details I missed for those who have stayed in either place in Tokyo? I do want to start building up loyalty with a hotel chain but if the Okura is worth it then I'm willing to book that instead. Also, if there's any hotels that people can recommend that are more expensive (but not by A LOT) I'm open to suggestions.",hotels,2,https://www.reddit.com/r/hotels/comments/17ux14h/which_hotel_should_i_book_for_tokyo_grand_hyatt/
2023-11-14,1699928298,Have you ever had a hotel charge a 715% increase from time of booking confirmation?,"Booked Hotel Indigo in Waco Texas for the eclipse next year. I called prior to the booking window opening and they took my information down for a waiting list. Got a email confirmation 4/25/23 with best flexible rate for $347 total for two nights which I felt a normal rate for a higher end hotel with a free cancellation until Feb 7th. Well I just checked the app and that total is now $2,831 with a free cancellation until Jan 8th. 


WTF. How are they allowed to do that???",hotels,9,https://www.reddit.com/r/hotels/comments/17urs7b/have_you_ever_had_a_hotel_charge_a_715_increase/
2023-11-14,1699926454,Finding cheaper hotels,"Me and my bf are going on a short trip in Australia, and we wanted to find cheaper hotel fares.
So I guess if anyone knows a good place to look for it or some tricks for cheaper travel!

I have travel a bit so we probably won't have issues with food or travel, but I have not figured out what is too much to pay for accommodation.

Thank you:D",hotels,1,https://www.reddit.com/r/hotels/comments/17ur5hg/finding_cheaper_hotels/
2023-11-13,1699898310,Question : Vegas location,"
I had a question. Friends and i will be going next year during a big event. The hotels im looking to book is 21 and up place.
My question is although im 21+ will my friends who are not 21 and up be allowed to enter our room? Also would having 4 people in a 2 occupancy matter.

Some location include but limited to:
Four queens hotel and casino
Circus circus

I am newish to the location. Thank you!",hotels,2,https://www.reddit.com/r/hotels/comments/17uggu2/question_vegas_location/
2023-11-13,1699896175,Graduation project,"Hi, I'm writing this post because I will soon have to present my high school graduation project. The project consists of an ideal eco-sustainable hotel in which my classmates and I collaborate, each having their own sector.
Ex: Art&gt; Works to visit in our area
Economy&gt; Costs and tourism company
Mathematics&gt; Data graphs about tourism
Ecc..

I will take care of the IT sector and will have the task of creating a platform that will simulate a hotel website. I remind you that the hotel is sustainable and is located in the area near the school.

Premises: I have no knowledge of programming but I like technology, that's why I chose this sector. I found ""WebFlow"" as a site creation engine and then I would like to transform the product into an html file without publishing it online, so that it has all the functionality of a site, but without any expense.

Now let's move on to my expectations: I would like the ""site"" to contain information about the hotel but also about the creation of the site itself which aims to have minimal environmental costs and promote tourism in my area. In fact, I would like the site itself to have its own value and to have content about which I can say something during the presentation (since I will have to present it during the oral test).

Now I ask you for help to give me ideas and practical advice regarding these points:
- Do you think WebFlow can work? Will I be able to download the working html file without having to publish it? If yes, how?
- What content should I add to the site to make it interesting, complete and consistent with my presentation? (Digital eco-sustainability, tourism, territory).
- How can I give the idea of a sustainable site? I mean for example by saying that I would publish it on servers with low energy consumption... or other ideas?

Thanks for the attention. Now I'm waiting to receive some ideas and answers to my questions so that I can create a finished, good quality product thanks also to the help of Redditors!",hotels,0,https://www.reddit.com/r/hotels/comments/17ufnn8/graduation_project/
2023-11-13,1699894648,Booking.com discussion,"Ive been a subscriber for more than 15 years. Ive used the service worldwide - primarily in the US, Europe and south and Central America. When the interface works its generally easy to use and designed in a thoughtful way with pics, a great mapping system and prices for hotels are given including taxes and fees for the entire stay, unique to this system in my experience.  Recently the system has been listing apartments for super cheap rates but then as one is about to confirm the reservation the cleaning fee appears and is frequently five times the rental fee. This an abhorrent corporate practice that the system has not used in the past. Other, major deficiencies become clear when things dont go as planned. Ive arrived at BNBs to find they had no rooms, or the room was not fit for  human habitation - box spring and no mattress, sink hanging off the wall with no hot water,  gas furnace on the wall without an external duct, live flame and no smoke alarms (in Milford CT!) etc. While in Hungary last month I was robbed of cash by cleaners and booking has not responded to three messages about the event after responding to only the first cursory mention of the robbery. I messaged the second time after fling a police report and explained I did not feel comfortable staying the second night, was moving to another hotel I secured on B.com and wanted a refund for the second night where I was robbed (of more than $700.00. They have not responded.  If one  needs customer service it is a labrythine process to find it and get more than a perfunctory response with the system taking no responsibility for the mistakes, misrepresentations and outright lies of the property. I think its time to take these concerns to AGs. Anyone else had less than ideal experiences trying to get satisfaction from this behemoth?",hotels,6,https://www.reddit.com/r/hotels/comments/17uf2do/bookingcom_discussion/
2023-11-13,1699867436,"PSA from hotel security, we can see y'all on camera","Hello, this is just to remind people staying in hotels that we do in fact have cameras. I am only saying this to make all of our lives easier, you are not being sneaky, I promise you. Don't try to smoke in the lobby, don't be sneaking around trying to open locked doors, going to the pool after hours, or opening exit doors. I see you, and everyone in security sees you, please stop for all of our sakes as it's super awkward for you when we confront you and annoying for us that you are just breaking rules. And if anyone is wondering, no, the people who do these things are not mostly kids so this applies to all of you, but for teens yes we do see you sneaking around and trying to get to the hot tub while you're on your school field trips. Basically, when you're in hallways, lobby, or elevators just try and act like you're on camera because you are.

EDIT: Unsurprisingly people are taking this too seriously, I understand people have bad experiences with security, but it does not mean my PSA is untrue. Any decent hotel you go to will have cameras and hopefully security to watch it, to answer some general questions/concerns. No, not every hotel has cameras everywhere, but just like every other service and business usually the more expensive it is the better it will be. Of course, that's not a universal truth and if you have legitimate security concerns then contact the hotel before booking and ask. I agree you shouldn't have to do that, but I unfortunately do not control all hotels so I can not make them put cameras in nor can I make them properly staff their hotels. Another thing is a lot of hotels do not have a dedicated security department, if you're wondering why, the answer is always money. We make no money for the company so many hotels opt to not have security and they just take the hit when customers get stuff stolen and never come back because it costs less than staffing an entire department. So just be respectful, my post won't deter criminals, and it won't make hotels fund departments or put in the proper equipment, there's nothing I can do to change that the same way a Starbucks employee can't change the prices. If you care about security then I recommend vetting the place before staying. So be safe out there, spend the money if you want to be in a safe hotel or don't, that's your decision. I do thank you guys though, I should have added into my PSA that not all hotels have proper security, and it seems not a lot of people were aware of that the same way a lot of people are unaware just how much security some hotels do have. I might respond to some comments, but a lot of you are just saying the same thing so I decided to just make an edit instead.",hotels,276,https://www.reddit.com/r/hotels/comments/17u6yoj/psa_from_hotel_security_we_can_see_yall_on_camera/
