date_utc,timestamp,title,text,subreddit,comments,url
2023-02-07,1675780637,Room Pricing,"I'm in Naples, Fl, high season, any nice rooms seem to be in the $500/night range.  Insane price for me.  Got the Hilton on HotelTonight for ~$300.  When I asked to extend they wanted $495. I managed another night at the same rate but why would the hotel not  extend ? Isn't that better than them paying another booking commission to HotelTonight?",hotels,5,https://www.reddit.com/r/hotels/comments/10w3dqb/room_pricing/
2023-02-05,1675632823,Wanting to surprise my girlfriend with a gift when she first walks into her room for valentines day. Possibility of this being feasible?,"Hey everyone, I have my girlfriend coming to town to visit over valentines day and the weekend. I was hoping to buy a bouquet of flowers with a nice card and have them in the room before she arrives, so she sees them when first getting to her room. I was thinking of tipping the front desk to leave them in her room for me on the day shes to arrive. Anyone with front desk experience know whether this would be feasible or not?",hotels,5,https://www.reddit.com/r/hotels/comments/10uo7ff/wanting_to_surprise_my_girlfriend_with_a_gift/
2023-02-05,1675620684,Feather toppers,"So I posted earlier this week asking what brand of mattress toppers the hotels use and I only got a couple of responses, and I think it is because I used the wrong terminology.  

I'm looking to find what type of feather toppers the hotels use (the kind that makes the bed feel like clouds) I have found a MASSIVE amount of them online and at this point am looking for hotel AND personal preferences.  

Please tell me the brand you or your hotel uses, and where I could find it.  

Also if you know another sub I can post this in for suggestions, please let me know, the bedding sub is pretty much inactive.

TLDR; what is your hotels and personal preference for feather toppers and where can I find them?  Also suggestions for other subs I can post to for this too.

TIA!",hotels,2,https://www.reddit.com/r/hotels/comments/10uj3bc/feather_toppers/
2023-02-05,1675569999,What are the biggest challenges hotel industry is currently facing?,I'm starting a Digital Marketing Agency for Hotels and researching like what are the biggest challenges that hotel industry is facing,hotels,13,https://www.reddit.com/r/hotels/comments/10u0ixo/what_are_the_biggest_challenges_hotel_industry_is/
2023-02-05,1675562209,How to get a room upgrade?,"We are going to a five star hotel soon. We have ""elite"" status from a credit card that says we will get a free room upgrade if it is available. Do ya'll have any tips for how to ensure to get an upgrade? And how to get the biggest possible upgrade? Thanks!",hotels,11,https://www.reddit.com/r/hotels/comments/10txwfc/how_to_get_a_room_upgrade/
2023-02-04,1675550500,Extended stay guest background check question,"Partner and I live a few hours from Vegas, and are facing housing issues. I had an idea to go to Vegas, stay at a ""weekly/Monthly"" extended stay type place while he looked for a job. This seems feesable, but I noticed they do background checks on guests. I don't even have a ticket on file, but my partner has a domestic violence misdemeaner on his from 6 years ago when he had a verbal fight with his dad, he ended up getting charged with a battery assalt eventhough nothing happened. He also got evicted around that time, he was living with his dad who is the actual one who got evicted, but I guess his name was on it too when I looked him up on the city sherrifs page. We live in CA, so it's a different state. I'm wondering is this stuff will make it hard for us, if it can just be under my name or any advice, thank you!",hotels,6,https://www.reddit.com/r/hotels/comments/10ttkq3/extended_stay_guest_background_check_question/
2023-02-03,1675443935,For Safety Reasons&,"Your room number should not be said out loud. Not by you. Not by the Front Desk. Any stranger could hear and before you know it, youve got a knock at your door at 2am. Its best practice to treat your room number like your credit card number. 

Similarly, do not write your room number on your room key card. This is why the front desk gives you a key card cover. That small piece of plastic is so easy to lose (happens daily at my hotel). Plus, the writing doesnt come off, so we cant reuse the key (theyre pretty expensive =,). If you lose your key on the street, you basically just gave a stranger access to you and your stuff. 

Hotel training (in my experience and study) tells the employee not to say the room number out loud to protect the guest. If you come to the desk with an issue with your room, theyre supposed to ask for your name and look up your room number in the computer. I get a lot of guests who give me their room number after I ask for their name and I cringe. We can only keep you safe if you help us.",hotels,5,https://www.reddit.com/r/hotels/comments/10spds3/for_safety_reasons/
2023-02-03,1675438139,The green goblin.,"Hotels have been getting dirtier and dirtier since the pandemic in 2020. The cleaners are doing less and less. 

I have stayed in hotels 278 nights since September of 21&. This is the first time Ive seen this! 

https://imgur.com/a/e50KlFe",hotels,1,https://www.reddit.com/r/hotels/comments/10sn0zx/the_green_goblin/
2023-02-03,1675432037,"want to book a hotel room, but don't own a credit card yet","This is one of the few times in my life I have felt completely ignorant of an important part of modern culture. I have a friend from out of town coming to visit for a week, and my credit score is barely 600. I notice a lot of the cards I can apply for require a $200 deposit, and that establishes a credit line. However, as most people know, hotel rooms are quite costly, and I don't quite understand how someone can book a room for a week with a $200 credit line, especially when the room is 120 a night, but REQUIRES  a credit card.",hotels,5,https://www.reddit.com/r/hotels/comments/10skp7i/want_to_book_a_hotel_room_but_dont_own_a_credit/
2023-02-01,1675278511,Anxious that I might've entered the incorrect CC details for a reservation,"I booked a hotel room for a convention that's happening around May. They have their own special block/rates and I booked through their system.

I won't get charged until like early May when the pre-arrival deposit gets charged.

Now the anxious part of me is like ""damn, did I enter the incorrect card details?"" I can only see the expiration date which is right. I don't think I can view the card information.

In situations like this, would my reservation have gone through if it was incorrect? Like if I entered the wrong credit card number, would it verify that it is wrong and prevent me from booking? Or would any number work and it's just ""holding my info on file"" until the charge?",hotels,3,https://www.reddit.com/r/hotels/comments/10r32n5/anxious_that_i_mightve_entered_the_incorrect_cc/
2023-02-01,1675255843,Ideas or Solutions for 4 people in a 2x Double bed setup? How to maximize sleeping space?,"My 4 person family travels a number of times a year and in many cases, out of our control, we are stuck with a 2 double bed setup.  For instance if we don't have a choice for travel soccer tournaments.  

The problem is that my 12 year old son is now bigger than my wife, so in essence 3 adults plus my smaller framed daughter have to share the 2 double beds.  These sizes are too small as we bump into each other all night.  

What suggestions, solutions etc. do you have which can help in that situation?  Anyone have creative solutions that can be done through purchases or doing something in the room itself?

* Extra room - would rather avoid if possible due to additional costs
* Small/portable air mattress for my daughter to get her out of a bed
* suggestions?",hotels,7,https://www.reddit.com/r/hotels/comments/10qtyv2/ideas_or_solutions_for_4_people_in_a_2x_double/
2023-01-30,1675039650,Opened my door to find someone in my room... or was I the one who walked into *their* room?,"Riddle me this: yesterday, when I opened the room to my hotel door with my electronic key, there were already people inside. How did that happen? How could we both have keys to the same room?

The moment I opened the door, I saw a young woman pacing and talking on her phone. I said ""Oh, sorry!"" and shut the door. A young man opened it a moment later to find out what was going on; he seemed as confused as I was. I told him I'd go back to reception to find out was going on.

Now, check-in had already been a bit rough, with a long line; every single person checking in seemed to have some kind of problem. Or perhaps the computers were just running slow? Anyway, I'd changed the date of my stay, so I'd already been through one round with staff trying to find our reservation.

The staff double-checked my ID and that I had the right room, then asked me to wait in the lobby while they went upstairs to check who was in my room. (As usual for this particular luxury hotel, only one lift was working for the entire building.)

The young couple had vanished! The room was empty! The staff probably figured I wasn't going back to that room in a hurry, so they moved me to a different one. I'm there now, with the deadbolt on the door.

A bug in the booking system? In the electronic key system? Ghosts? How did two sets of guests end up with the keys to the same room? That's not just inconvenient, it could be dangerous. I've googled a little without being able to find a straightforward explanation, though I suspect the staff know what happened and weren't in a big hurry to tell me! Any hotel staff have a likely explanation?

(I've stayed at this hotel many times, but I might just give one of their competitors a try next time. Mostly because of those lifts!)",hotels,17,https://www.reddit.com/r/hotels/comments/10oo00c/opened_my_door_to_find_someone_in_my_room_or_was/
2023-01-29,1675017648,Mattress Toppers,"Does anyone know the brands hotels use for mattress toppers? I have been trying to find the answer, but can't anywhere, and don't want to buy hotel branded toppers (i.e. shopmarriott)",hotels,3,https://www.reddit.com/r/hotels/comments/10oexmu/mattress_toppers/
2023-01-29,1674974410,which one was your last?,"i dont travel much, my last hotel trip was with marriot i think.

that was years back, i feel like the bathroom is the most important aspect.

then we get to all the bells and whistles.",hotels,3,https://www.reddit.com/r/hotels/comments/10o15io/which_one_was_your_last/
2023-01-29,1674951147,Software Room Status Management,"&amp;#x200B;

Hello, i just wanted to take 1/2 minutes from you. Would you mind fill this forms about a app im doing for a school project. Since everyone here work or worked at hotel. Thank you for your attention. (hopefully they don´t kick my post)

[https://docs.google.com/forms/d/e/1FAIpQLSehB89HADcq7EGH5WQQ\_XQZbWkyHRHB2MXfWHH58hzmzgqy4A/viewform?usp=sf\_link](https://docs.google.com/forms/d/e/1FAIpQLSehB89HADcq7EGH5WQQ_XQZbWkyHRHB2MXfWHH58hzmzgqy4A/viewform?usp=sf_link)",hotels,5,https://www.reddit.com/r/hotels/comments/10ntt99/software_room_status_management/
2023-01-29,1674950952,Checkout times kinda discriminate against people who work nights or have an alternate sleep schedule,"I know you can sometimes ask for a later check out time, and I understand if they need to turn the room in a busy place. But if the hotel is basically empty I don't see why someone can't check out at later. 

This comes from a wildly condescending interaction from a front desk lady after forgetting to set an alarm and missing checkout in an empty hotel by 20 minutes. 

Is there a reason some hotels are so seemingly arbitrarily aggressive about this?",hotels,5,https://www.reddit.com/r/hotels/comments/10ntqp2/checkout_times_kinda_discriminate_against_people/
2023-01-27,1674856524,"Terrible service, what to do next ?","So I booked a night at the red roof (in my home town which I have stayed at numerous times over the years ) its 2 star.. but I have dogs. So its fine.

I got here at 230.. said she didnt know if room would be ready by check in at 3..
So I go back to my car and come back and check at 315.. they tell me that Priceline hasnt paid them yet. So 2 hours later phone calls to and from something is wrong with the credit card machine that Pricelines card is not going through. Priceline is blaming it on the the hotel and vice versa. Between the interactions Im seeing while sitting here and the recent reviews Im reading online, this place has dramatically gone downhill. Its sad because at one point they were a decent 2 star hotel that I always boasted how polite  their  staff were.

Now they are hitting me with a $100 deposit .. which was NEVER the case prior. I lost my bank card and put this on my cash app card. So I dont have the cash on me nor do I have a credit card. Nowhere on Pricelines website or confirmation paperwork does it
Mention this, or on the website does it mention ANYWHERE. And now its too late to go to my bank to be able to get any money out.

What are my options ? The problem with their system and the credit card had nothing to do with me.  The service here is so sub par and if I were to ask for a refund it obviously would not be immediate and I would be stuck in the car in the freezing cold for the night. 

Im literally appalled. 
Can they legally require me to put down for incidentals (I dont smoke or anything) thats even if I can get this credit card issue figured out ?",hotels,16,https://www.reddit.com/r/hotels/comments/10mx9zm/terrible_service_what_to_do_next/
2023-01-26,1674698714,"first time booking a hotel room, have questions","as the title says, I just booked a hotel room for the first time and have two questions. do hotels send  email confirmations? I booked like two hours ago online via their website and haven't gotten any email confirmation yet but did end up on the page that looked like what a booking confirmation page would be; like a summary page, and thanked me for booking; that kind of thing. the last question, does booking a room show up on bank statements? like on my card activity? my online account shows me records of were/ what I've used the card and stuff and it typically shows pretty quick but I haven't seen any record for it yet. would that mean the booking didn't go through? I'm in the US if that info is needed here.",hotels,18,https://www.reddit.com/r/hotels/comments/10lgl6n/first_time_booking_a_hotel_room_have_questions/
2023-01-26,1674691874,Room service tips?,"
Hey everyone I'm coming to America for the first time during the summer with a work and travel program. I'm looking at all the jobs offered and there is room service server one in Denver (4 star hotel) that has a pretty high hourly wage, has free food and housing (only job offered that has that) and also includes tips. I was wondering how much tips do room service servers earn in America? I'm from Europe and I always worked regular bartender jobs in cafes, clubs and stuff like that. I always earn maybe double my salary in tips, is it the same in room service or should I look for something similar to a bartender for more tips? Thank you guys in advance.",hotels,4,https://www.reddit.com/r/hotels/comments/10le5kd/room_service_tips/
2023-01-25,1674664184,Atari Hotels presentation video- Dec '22., https://twitter.com/PowerDubs/status/1618282060921331712?s=20&amp;t=wosj62QEP90N0DrTF2dXyg,hotels,0,https://www.reddit.com/r/hotels/comments/10l2r01/atari_hotels_presentation_video_dec_22/
2023-01-24,1674559775,"Stuck on audit for two days because this girl thinks she ""might have eaten moldy bread and isnt feeling well""","Agm here! Im so over my new auditor. The girl has already called out 3 times since the 1st. First time ""her brother borrowed her car to drive someone to the airport and wont be back in time for her shift"". Now she thinks she ate moldy bread and doesnt feel well. Personally I think its an excuse not to come in and I'm over it. 

On top of this, she wanted full time hours, but told me a few days ago she actually can't work full time anymore because the grocery store she works at is ""in peak season due to valentines day coming up."" We even helped her out by paying her in advance so she could pay her bills, but its like she has no consideration or appreciation. Maybe she really is sick. Its just frustrating!",hotels,4,https://www.reddit.com/r/hotels/comments/10k3d2j/stuck_on_audit_for_two_days_because_this_girl/
2023-01-24,1674519762,Choice Hotels Leadership Team and Contacts,"My husband and I stayed at Comfort Suites Airport in Nashville between 11/4/22 and 11/5/22.  We booked and paid for our room through Priceline.  Upon check out we were charged $250 cleaning fee because the room was heavily smoked in.  The problem is that neither one of us smokes.  We reached out to customer service and were deferred to the hotel directly; however, when we reached out to the hotel, front desk was rude and refused to transfer us to the manager.  We emailed the manager and never received any response.  We are now trying to escalate this issue to corporate and having a hard time finding the contact info for the leadership team of Choice Hotels.  The fact that the hotel refuses to cooperate tells me that they have no evidence of us smoking in the room, and we can submit medical records to prove that we dont smoke.  What the hotel did is wrong and one can argue that it is theft.  If anyone happens to know the contact info for the Choice Hotels leadership team, can you please share with us?  If anyone or someone you know has experienced the same issue, please also share your approach.  

We also tried disputing the charges with our credit card company, Wells Fargo, but were unsuccessful.  They refused to hear our case and kept deferring us to the hotel directly.

Any thoughts, comments, and help would be greatly appreciated!",hotels,12,https://www.reddit.com/r/hotels/comments/10js7fw/choice_hotels_leadership_team_and_contacts/
2023-01-23,1674517150,STR website slow,Is anyone else having issues with STRs website for the data portal being extremely slow?,hotels,2,https://www.reddit.com/r/hotels/comments/10jr8f0/str_website_slow/
2023-01-23,1674439135,Is it possible for me and two other people to split the payment for a stay at a hotel?,"Sometime in March of this year, me and two of my friends are going to stay at a hotel in Pittsburgh, Pennsylvania, for three days, and all three of us want to know if it would be possible to split the cost of a hotel in order to save money.  

Are there any hotels in and around Pittsburgh that will allow this?  Also, we want the hotel to be affordable in price.",hotels,10,https://www.reddit.com/r/hotels/comments/10j0u45/is_it_possible_for_me_and_two_other_people_to/
2023-01-20,1674237375,https://youtu.be/y6rteghIJ6M,https://youtu.be/y6rteghIJ6M,hotels,0,https://www.reddit.com/r/hotels/comments/10h3hrf/httpsyoutubey6rteghij6m/
2023-01-20,1674192427,Hotel Grand Opening?,"Hey Redditors&I am the director of sales &amp; marketing for a hotel that opened in Feb 2020. Then Covid happened &amp; we didnt get to have our Grand Opening, but are FINALLY planning it for next month. It will be a grand opening/customer appreciation/attempt to get new customers/all-around kind of meet &amp; greet get together. I feel like it cant really be called a grand opening since weve been open for three years.  Does anyone have any clever suggestions on what we should call it??",hotels,9,https://www.reddit.com/r/hotels/comments/10goi7x/hotel_grand_opening/
2023-01-20,1674174707,Pillows at the Aria. Heaven. What brand?,I need a GOOD quality pillow. Aria has perfect ones. (12/2022 stay)Anyone know the brand or where I can buy?,hotels,7,https://www.reddit.com/r/hotels/comments/10gi88z/pillows_at_the_aria_heaven_what_brand/
2023-01-19,1674096854,Tip Hotel Housekeepers?,Is it customary to tip Hotel Housekeepers when checking out?,hotels,21,https://www.reddit.com/r/hotels/comments/10fqhl1/tip_hotel_housekeepers/
2023-04-19,1681942639,How To Cancel and Get A Refund From A Seemingly Unstaffed Hotel?,"Last month, I booked a stay at this hotel in Montreal for May (website url copied below). Circumstances changed and now I need to cancel, but I haven't actually been able to for the past three weeks. 

They charged my credit card the cost of the full stay up front, but the booking confirmation explicitly states that reservations cancelled more then 1 week in advance are refunded in full. Seems reasonable, but here's the catch. There's no way to cancel the reservation. 

They have an email address to direct such requests, but the inbox seems unmonitored. My first cancellation request in March still has no reply, much less the subsequent ones I've sent. They also have a front desk/customer service phone number, but there has not been a single time someone answered the phone in the past month. I've left voicemails with callback numbers, but like the emails, they are never returned. 

This hotel appears to actually exist from what I can tell, but seems to simply not have staff monitoring their phones or emails. 

Assuming this trend continues up to my booking date, do I have any recourse? Is there any alternative path to getting my money back or am I just realistically out $1,000? Curious if anyone has ever found themselves in a similar position.

[https://www.hygiehotel.com/hotel](https://www.hygiehotel.com/hotel)",hotels,0,https://www.reddit.com/r/hotels/comments/12scafa/how_to_cancel_and_get_a_refund_from_a_seemingly/
2023-04-19,1681940127,5 Star New York Hotels closed in New York Central Park south,"Hello there, I am trying to figure out where I stayed in New York around 2001. It was a 5 Star hotel close to the St. Moritz. For some reason I cannot remember its name. I cant find it anymore so it appears to have closed. What 5 Star hotels have closed in that neighborhood?",hotels,0,https://www.reddit.com/r/hotels/comments/12sb17r/5_star_new_york_hotels_closed_in_new_york_central/
2023-04-19,1681910457,Is the Grand Hotel price on Mackinac Island worth it?,"I know it includes a nice breakfast daily, but the pricing still seems excessive",hotels,6,https://www.reddit.com/r/hotels/comments/12rt369/is_the_grand_hotel_price_on_mackinac_island_worth/
2023-04-18,1681850434,How do y'all receive RFP's?,"Hi I'm the assistant manager of a 90+ room hotel. We're located 1 mile from a very popular them park and 2 blocks from a convention center. We tend to fill up on convention days but we don't pick up a lot of group bookings. How do y'all get RFP's or group requests?

Edit: I'd like to thank everyone for replying. It's my first time doing sales and I have a lot to learn! I was previously a FD agent.  It seems my Cvent account wasn't linked to the license so I wasn't able to receive RFP's. I contacted them and am working on fixing that. I've also viewed some  of the On Demand training from their recent event. 

I'm also more active on HotelPlanner, and while it may only be for 7 RN I booked my 2nd group in as many months. 

&amp;#x200B;",hotels,12,https://www.reddit.com/r/hotels/comments/12r3l0b/how_do_yall_receive_rfps/
2023-04-18,1681848543,When does a booking.com cancellation fee come out of your bank account? Check in day?,"I'm expecting a cancellation fee from booking.com. However, I emailed the property to ask when the fee would come out of my account, and also to let them know that the card they had on record had expired. They came back and said I should already have been charged (I definitely haven't) and made no comment about the card at all. Have I escaped justice or is it likely to come out on check in day?",hotels,4,https://www.reddit.com/r/hotels/comments/12r2le9/when_does_a_bookingcom_cancellation_fee_come_out/
2023-04-18,1681786450,ACCOR-Plus membership is BS to me,"I am an Accor-Plus member and have issues with it many times.

Just now I made a booking for a hotel in Sydney. The Accor-Plus terms state, that you get 10% off of the public room rate, however, if you book through their app, the price is higher than on [booking.com](https://booking.com) or even on the page of the hotel.

&amp;#x200B;

With the membership, you are granted a discount on food, the rate depends on how many people you are with. If you are 2 people, you'll get 50% off which is great. However, if you are 4 people and two of the group have the membership, they will only grant 25% discount, as only one card applies per table. Even if you split the bill.

There are Black Out dates, where you won't get the benefits, such as Christmas, Valentines day (!!!), Mothers Day etc.

You need to eat in the restaurant. If you eat at the pool, no discount will be applied.

I'm getting more and more annoyed by that membership program.

&amp;#x200B;

Are you Accor-Plus member? What are your thoughts on it?",hotels,9,https://www.reddit.com/r/hotels/comments/12q7qme/accorplus_membership_is_bs_to_me/
